{
  "schema_version": 1,
  "artifact_role": "PROJECT_INTEGRATION_CAPSULE",
  "authority": "READ_ONLY_BINDING_NOT_CANON",
  "status": "TEMPLATE_NOT_CONFIGURED",
  "project": {
    "project_id": "example-game",
    "repository": "owner/example-game",
    "base_branch": "main",
    "worktree_branch": "NOT_CONFIGURED",
    "base_sha": "0000000000000000000000000000000000000000",
    "result_sha": "0000000000000000000000000000000000000000",
    "worktree_relative_root": "."
  },
  "decision": {
    "decision_id": "NOT_CONFIGURED",
    "approval_status": "NOT_CONFIGURED",
    "approval_ref": "NOT_CONFIGURED",
    "decision_record_path": "docs/CURRENT_CONFIRMED_DECISIONS.md"
  },
  "authority_refs": {
    "workspace": "docs/operations/PROJECT_WORKSPACE_AUTHORITY_CONTRACT.json",
    "notion_isolation": "docs/operations/NOTION_PROJECT_ISOLATION_AND_CORE_SYSTEM_CONTRACT.md",
    "gpt_codex": "docs/GPT_CODEX_WORKFLOW_POLICY.md",
    "godot": "docs/knowledge/godot/HIGODOT_SINGLE_AUTHORITY_AND_SAFE_OPERATION.md"
  },
  "base_adapter": {
    "path": "skills/PROJECT_BASE_ADAPTER.json",
    "sha256": "0000000000000000000000000000000000000000000000000000000000000000"
  },
  "notion": {
    "access_mode": "SEARCH_FETCH_ONLY",
    "project_relation_count": 0,
    "project_key": "NOT_CONFIGURED",
    "record_key": "NOT_CONFIGURED",
    "revision": 0,
    "last_edited": null,
    "readback_status": "NOT_RUN",
    "existing_page_write": "FORBIDDEN"
  },
  "codex": {
    "workspace_access": "LOCAL_WORKTREE_NATIVE",
    "godot_direct_write": "FORBIDDEN",
    "mutation_authority": "NONE_READ_ONLY",
    "external_connectors_during_mutation": "DISABLED"
  },
  "godot": {
    "engine": "GODOT",
    "authoring_provider": "hi-godot/godot-ai",
    "writer_authority": "SOLE_PERSISTENT_GODOT_AUTHORING_AUTHORITY",
    "adoption_record_path": "docs/operations/HIGODOT_ADOPTION_RECORD.json",
    "adoption_record_sha256": "0000000000000000000000000000000000000000000000000000000000000000",
    "network_mode": "LOOPBACK_ONLY",
    "operation_level": "L0_OBSERVE",
    "editor_project_root": ".",
    "project_godot_sha256": "0000000000000000000000000000000000000000000000000000000000000000",
    "direct_filesystem_write_enforcement": "NOT_RUN"
  },
  "change_boundary": {
    "write_allowlist": [],
    "codex_forbidden_godot_paths": [
      "project.godot",
      "**/*.gd",
      "**/*.tscn",
      "**/*.tres",
      "**/*.res",
      "**/*.scn"
    ],
    "unexpected_tracked_diff": "NOT_RUN"
  },
  "cost_surface": {
    "boundary": "ZERO_INCREMENTAL_COST_REQUIRED",
    "allowed_service_classes": [
      "GPT_PRO",
      "NOTION_FREE",
      "LOCAL_OPEN_SOURCE_TOOLS"
    ],
    "prohibited_metered_services": [
      "OPENAI_API_PAYG",
      "PAID_CI_RUNNER",
      "PAID_NOTION_AI",
      "PAID_REMOTE_HOSTING"
    ],
    "status": "POLICY_NOT_ADOPTED"
  },
  "acceptance": [
    {
      "acceptance_id": "ACC_READ_ONLY_BINDING",
      "statement": "Bind one exact project across Git, Notion, and Godot without product-file mutation.",
      "status": "NOT_RUN",
      "evidence_ids": []
    }
  ],
  "evidence": [],
  "rollback": {
    "rollback_ref": "0000000000000000000000000000000000000000",
    "procedure": "Restore rollback_ref in an isolated worktree and rerun the capsule check.",
    "drill_status": "NOT_RUN"
  },
  "reality_gate": {
    "exact_head": "NOT_RUN",
    "notion_readback": "NOT_RUN",
    "godot_import": "NOT_APPLICABLE",
    "writer_exclusivity": "NOT_RUN",
    "rollback_drill": "NOT_APPLICABLE",
    "final_status": "BLOCKED_UNVERIFIED"
  },
  "evidence_ceiling": "POLICY_AND_STATIC_CONTRACT_ONLY"
}
